id,text,CTTR,Score,Ellis,Moritz
168757160,"block-time published-time 4.53pm BST

Weir Group voted down on pay policy

Some late, breaking AGM news now and the shareholder spring is in full flow with
a big upset for engineering group Weir.

There was a 72.4% vote against Weir's remuneration policy.

The Glasgow engineer had two votes on pay, and the policy vote was also going to
be subject to close scrutiny given it included a share award which was not
linked to performance.

Weir had argued it had used this policy for US directors and said the pay for
the chief executive was down last year.

Ahead of the vote, Hermes, representing pension funds, had said: ""We are
recommending to clients that they vote against, due to the proposed award of
restricted shares which are not tied to performance targets.""

So it's back to the drawing board for Weir.

enltrAnd so the shareholder protests continue: Engineering company Weir gets a
72.4% vote against the remuneration policy

- Jill Treanor (@jilltreanor) April 28, 2016

enltrWeir says it will continue to operate under the remuneration policy which
was approved by shareholders in 2014

- Jill Treanor (@jilltreanor) April 28, 2016

block-time updated-timeUpdated at 4.54pm BST

block-time published-time 4.45pm BST

FTSE erases losses to finish marginally up on the day

On financial markets, London shares have managed to claw back some ground this
afternoon and the FTSE 100 erased early losses to finish virtually unchanged on
the day.

The London bluechips index is 2.5 points higher at 6,322.40. It had earlier
dropped sharply as markets around the world were dragged lower on disappointment
at the Japanese central bank's decision not to come up with any fresh stimulus
measures.

It's a similar story of little change on the day across European stock markets
with France's CAC40 index down just 0.3% and Germany's Dax up 0.1%. Spain's Ibex
has fared worse, down 0.8%.

block-time published-time 4.35pm BST

Another FTSE 100 company -building materials business CRH - has also had a
protest over pay, this time a binding vote over policy.

Jill Treanor reports that just over 40% of shareholders voted against the new
pay policy - which covers the next three years - and which increases the chief
executive's pay potential by 50%.

CRH, as an Irish incorporate company but listed in London, did not technically
have to put its pay policy to a vote.

Its remuneration report, which covers pay for 2015, had an 8% vote against.

block-time published-time 4.13pm BST

Back to AGM showdowns now and my colleague Julia Kollewe has been at the
Schroders AGM today, where shareholders registered their frustration with the
elevation of former chief executive Michael Dobson, who ran the investment firm
for more than 14 years, to chairman.

Julia reports:

Nearly 15% voted against Dobson's re-election, and almost 12% voted against Lord
Howard of Penrith, the senior independent director who oversaw the move.

Hermes, which represents pension funds and had urged other investors to oppose
Dobson's promotion, voted against both.

It is a sizeable protest vote, given that the Schroders family owns 48% of the
shares. Some 4% of investors voted against the firm's remuneration report.

At the meeting in London, Lord Howard said the company was aware that it was
breaching corporate governance guidelines by making Dobson chairman, but
defended his promotion. ""We thought he was such a good and such an obvious
candidate,"" he said.

One of the biggest fund managers in the City, Schroders had consulted its 10
largest investors, and ""overall we received considerable, a lot of support""
although he admitted that there were ""some shareholders who had concerns"".
Howard said the company would continue to talk to them.

Royal London Asset Management voted against Schroders' pay policy and the
appointment of Dobson as chair. Its corporate governance manager Ashley Hamilton
Claxton said: ""Although Mr Dobson was successful in leading the company as CEO,
his appointment as chairman is inappropriate and in clear violation of the
corporate governance code.""

block-time published-time 3.57pm BST

There have been fresh developments in the BHS story this afternoon.

Following the retailer's collapse into administration on Monday, Sir Philip
Green and Dominic Chappell face being hauled in front of MPs to explain their
management of the company after an influential parliamentary committee launched
an inquiry into the department store chain.

enltrWe've launched our inquiry looking into the sale and acquisition of #BHS.
Find out more about the inquiry: https://t.co/g54k9Lp4AC

- BIS Committee (@CommonsBIS) April 28, 2016

Graham Ruddickreports :

The Commons Business, Innovation and Skills (BIS) select committee has announced
it will explore the sale and acquisition of BHS, including whether the directors
of Green's Arcadia and Retail Acquisitions acted as best they could to fulfil
their statutory duties.

BHS called in administrators on Monday, putting almost 11,000 jobs at risk. The
retailer was owned by Green for 15 years until he sold it for 1 last March to
Retail Acquisitions, a consortium of little-known accountants and lawyers led by
Chappell.

BHS's collapse has caused controversy because it has been saddled with a 571m
pension deficit despite Green collecting more than 580m in dividends, rent and
interest payments during his ownership, with Retail Acquisitions receiving
payments of more than 25m from BHS over the last 13 months.

The full story:

Related:  BHS collapse: Sir Philip Green may face grilling by MPs

block-time published-time 3.42pm BST

Minions married up with Shrek in DreamWorks deal     The deal brings together
DreamWorks Animation and NBCUniversal-owned Illumination Entertainment, maker of
Despicable Me, pictured here. Photograph: Photo Credit: Universal Pictures and
Illumination Entertainment/Publicity image from film company

In US company news, Disney will have to size up to a formidable rival after
confirmation from Comcast's NBCUniversal that it has lined up a $3.8bn deal to
buy DreamWorks Animation, maker of hits from Shrek to Kung Fu Panda.

The deal will see DreamWorks Animation come under the same roof as
NBCUniversal-owned Illumination Entertainment, maker of the hugely profitable
Despicable Me films and spin-off Minions.

The deal, a healthy premium on DreamWorks Animation's $2.3bn stock market
valuation, is expected to close by the end of the year subject to clearance by
competition regulators, reports Mark Sweney.

Mark's full story:

Related:  Comcast's NBCUniversal to buy DreamWorks Animation in $3.8bn deal

block-time published-time 3.27pm BST

Back with the main economic story of the afternoon, the sharp slowdown in US GDP
growth in the first quarter, as reported earlier, forms part of a worrying
global trend, in the eyes of our economics editor Larry Elliott.

Central bankers around the world are getting diminishing returns on their
actions and all the major economies are expanding more weakly than they were in
the middle of last year.

The global economy is running out of steam and the conventional weapons are
increasingly ineffective. This is not about blizzards shutting factories in
Michigan. It goes much deeper than that,"" writes Larry.

Here's the full comment:

Related:  Sluggish US growth forms part of a worrying global trend

block-time published-time 3.19pm BST

Sticking with UK news for a moment, Jill Treanor and Julia Kollewe have been
following shareholder rebellions over pay today.

They have more details on the majority of investors at Shire pharmaceuticals
failing to support a 25% pay rise for its chief executive, Flemming rnskov. The
report continues:

The increase in his salary to $1.7m (1.2m) means rnskov's bonuses are also
going up, a move which shareholders had been urged to protest against before the
annual meeting on Thursday.

The advisory pay vote squeezed through, as holders of 50.5% of the shares in the
Dublin-based but London-listed FTSE 100 company voted in favour - but if
deliberate abstentions were included, support for the board fell just below 50%.

It builds on the defiant mood in which the AGM season started earlier this month
when there were ""no votes"" at two FTSE 100 companies - BP and Smith & Nephew -
on the same day. Mining company Anglo American has also faced protests over pay,
with more than 40% of investors voting against its remuneration report last
week.

Jill and Julia's full story is here:

Related:  Shareholder rebellions gather pace with Shire pay revolt

block-time published-time 3.11pm BST

Carney cites EU referendum risks as he notes UK slowdown

Bank of England governor Mark Carney has been in Stockport this week and talking
about the EU referendum again.

Growth appears to be slowing ahead of June's vote, said Carney, who has
previously warned that Britain's economy could struggle to grow after a decision
to quit the European Union. The referendum itself posed a significant risk to
the economy, the Canadian said.

He told the Stockport Express newspaper : ""In the very short term the economy
appears to be slowing, probably related to issues around the referendum. One of
the responsibilities of the Bank of England is to manage risk and financial
stability.

""Risks around the referendum are the biggest risks facing the UK economy, we
have contingency planning to decrease the potential impacts of uncertainty.""

As we reported yesterday, the latest official figures showed UK economic growth
slowed markedly in the first quarter of this year to 0.4% from 0.6% in the final
three months of 2015. But economists are divided over how much of the slowdown
could be blamed on the referendum.

The full interview with Carney, including him fessing up to drinking a whole
half pint of beer while on duty (gasp!) is here.

enltr #BankofEngland Governer Mark Carney in #Stockport to talk potential
#Brexit and beer https://t.co/siGlflCLhCpic.twitter.com/o04nVLW6ky

- Stockport Express (@stockportnews) April 28, 2016

block-time published-time 2.36pm BST

In other UK news... the business select committee has launched a full inquiry
into the collapse of high street chain BHS.

They will investigate the sale of the business by Sir Philip Green for 1 last
year, what due diligence was done by the buyers, and whether the taxpayer is now
on the hook for BHS's pension bill.

Iain Wright MP,  committee chair,  says:

""The collapse of BHS brings misery and uncertainty for thousands of workers and
also places a potentially significant burden on the taxpayer in the form of
pension liabilities.

The sale and acquisition of BHS raises real questions about whether directors
acted in the best long-term interests of the company and their employees. Is
there too much of an incentive in the system for owners to asset-strip, take out
vast sums for personal gain, and then dump and run leaving the taxpayer to pick
up the tab when the company fails, rather than create value for the long-term?

block-time published-time 2.29pm BST

Back in the UK, Royal Bank of Scotland has admitted that it will probably fail
to sell its Williams & Glyn division by the end of next year.

It has just warned that City that it will probably miss a deadline of the end of
2017 to offload more than 300 branches, due to the complexity of separating
customers from the rest of RBS.

The overall financial impact on RBS is now likely to be significantly greater
than previously estimated, it admits.

RBS shares have been hit hard, down 4.6%.

block-time published-time 2.09pm BST

This is the third year running in which US growth has been alarmingly weak in
the January-March quarter.

enltrUS Q1 GDP +0.5%. That's annualized, so economy virtually ground to a halt.
GDP trend pretty clear in last two years: pic.twitter.com/xYVAAnHcmp

- Jamie McGeever (@ReutersJamie) April 28, 2016

block-time published-time 2.05pm BST

Weak growth = no June rate hike

There's no chance of the US central bank raising interest rates while growth is
so weak, argues Tom Floyd of Foenix Partners.

According to Floyd, Americans can stop worrying that interest rates might rise
in June.

Despite the Fed's best efforts to leave the door open for a hike at the next
meeting, today's GDP data risks blowing it firmly shut. The data, showing a rise
of just 0.5% in the first quarter versus expectations of a rise of 0.7%,
undermines the more hawkish Fed tone from last night and does little to justify
an imminent raise.

Although the Fed dropped language acknowledging global risks it is worth noting
the next meeting is only 8 days before the next major global risk event, the
Brexit vote.

In light of the soft data and the looming referendum, a June hike is looking
increasingly unlikely with Janet Yellen's attempts to convince markets to the
contrary becoming largely futile. Traders will remain rightly sceptical.

block-time published-time 1.57pm BST

Nancy Curtin, Chief Investment Officer at Close Brothers Asset Management, is
also concerned by the slowdown in US growth:

""The US economy hasn't run aground by any means, but it is navigating more
difficult domestic waters than three months ago. Growth has been weighed down by
weak performances in the manufacturing and energy sectors due to the strong
dollar and volatile oil prices. On top of this, consumer confidence has been
knocked recently, impacting retail sales.

""Although today's results clearly indicate a slowdown in growth, it's important
to remember that the US economy has still expanded. The labour market is in
reasonably good shape, and global risks seem to be slightly more muted than at
the start of the year. This will help support domestic momentum as the year
progresses.

block-time published-time 1.57pm BST

Paul Sommerville of Sommerville Advisory Markets says an annualised growth rate
of 0.5% is 'woeful'.

block-time published-time 1.50pm BST

This is America's weakest quarterly growth rate in almost two years:

enltrQ1 keeps up its 'low-growth' reputation. US #GDP growth in Q1 +0.5%
annualized, below expectations. pic.twitter.com/K87sDaTR40

- jeroen blokland (@jsblokland) April 28, 2016

And while consumer spending is up, exports and business spending have fallen -
suggesting the US recovery is uneven, as well as weak.

block-time updated-timeUpdated at 1.54pm BST

block-time published-time 1.36pm BST

US economy almost stalls

Breaking news from America: The US economy has barely grown at all in the last
three months.

US GDP expanded by 0.5%, on an annualised basis, according to the US commerce
department.

That's a quarterly growth rate of just 0.125% - a very measly outcome - and
weaker than the 0.4% which Britain reported yesterday.

Although consumer spending rose by 1.9%, business investment tumbled by 5.9%,
suggesting corporations cut back sharply.

enltrU.S. GDP +0.5%. Business spending down 5.9%, the biggest drop since the
waning days of the recession.

- Jeffrey Sparshott (@jeffsparshott) April 28, 2016

block-time published-time 1.08pm BST

Here's Graham Ruddick's early story about this morning's session, in which Tata
Steel's UK boss warned of 'disaster' looming unless a deal is reached.

Related:  Tata Steel UK boss warns of pension timebomb if buyer not found

block-time published-time 12.30pm BST

Sajid Javid's testimony: What we learned

Sajid Javid has been spoken of as a future prime minister. Even Forbes Magazine
got in on the act, saying it would be a cheering rags-to-riches story if Javid
got the keys to Number 10.

But his hopes of a glittering career are now tightly bound with the future of
Britain's steel industry. Today's session showed us that:

1) Javid regrets that fateful trip to Australia.

He freely admitted that, with hindsight, he should have flown to Mumbai last
month as Tata's board decided what to do with its UK steel plants.

He also insists it wouldn't have done any good, as his department has been
working behind the scenes since February. But we'll never know if Tata might
have softened the tone of its announcement, if Javid had been banging on the
boardroom door promising to do whatever it took to keep the mills running.

Javid failed to shake off the impression that the government was caught out by
Tata's decision - suggesting it didn't actually have a full grip on the crisis.

And if Port Talbot closes, Javid may go down in political history as the man who
took his teenage daughter on a jolly to Australia as the steel industry burned.
Harsh game, politics.

2) It's all about the pensions.

Javid agreed with Tata's Steel UK SEO Bimlendra Jha that the pension liabilities
are crucial.

Several potential buyers have already said they wouldn't take them on, so Tata
and the government need to find a way of resolving the 15bn scheme, and its
deficit.

Javid claims that Tata's pension scheme is not a 'major risk' to taxpayers. But
that's not the same as saying taxpayers won't pay a penny....

And don't forget that Jha warned of economic and social disaster if the pension
problem isn't dealt with...

3) The government won't own more than 25% of British steel.

Javid is committed to taking a 25% stake in Tata UK, if it helps find a buyer.
But that's his limit - anything more would, in his view, be counterproductive.
That's a typically Thatcherite view, and means full nationalisation isn't on the
cards.

block-time updated-timeUpdated at 12.33pm BST

block-time published-time 11.58am BST

Sajid Javid today Photograph: Parliament Live

Q: Finally, what can you do to reassure customers and suppliers to keep working
with Tata steel at this time?

Sajid Javid says he has already written to all Tata's customers and suppliers,
and contacted the largest ones directly.

He has also asked Tata to give similar reassurances.

But the biggest comfort I can give is the action that we are prepared to take,
and how far we will go to get a deal.

That means customers and suppliers can look at this and say 'this business has a
long-term future'.

It's an ongoing process too - we need to keep reassuring people.

Javid concludes the session by insisting that the government is doing everything
it can, along with other partners such as the Welsh government and unions.

The Community union couldn't be more helpful if it tried, he concludes.

That's the end of the session.

block-time published-time 11.53am BST

Javid: We want a quick deal

Q: If a potential buyer says it needs nine months to agree a deal, but Tata
insist on a quick deal, would you step in with a bridging loan?

I'm not going to rule anything out, Javid replies, but the focus is to find a
commercial operator quickly.

A nine-month process isn't in anyone's interest.

Q: You have offered to take a 25% stake in Tata UK. Is that your maximum limit?

Javid says his offer of 25% co-ownership was designed to show potential buyers
that he's serious about getting a deal.

But the 25% figure is important - if you go over that, the government would be a
significant shareholder, and too closely involved.

Q: How long would you be prepared to hold this stake before looking to exit?

Javid says it's too early to say.

block-time published-time 11.49am BST

Q: Unions have told us they would favour scrapping the lesser duty rule, in
favour of a new solution just for the steel sector. Is this under consideration?

Javid says he still supports the lesser duty rule [ this is the rule that
prevents higher tariffs being imposed on Chinese steel ]

The lesser duty rule works, Javid insists. Its intention is to stop dumping or
provide compensation.

If we scrapped it, we would have spent an extra 500m on the solar industry for
example [because the lesser duty rule covers a range of industries, not just
steel]

Q: Do you believe Tata are a responsible seller, given they didn't fully brief
you about their plans for a quick sale?

Yes, Javid replies, based on the conversations I'd had with them. They have
approached this issue responsibly.

Q: Is there timeline appropriate? They are talking about finding a buyer within
weeks, but this will take months.

Tata are losing money every day, so they can't have unlimited time. But it is
important that they do everything possible to find a responsible buyer.

I have every reason to believe that when they promise to be responsible, that
will be reflected in the timeline, Javid  hints.

block-time published-time 11.41am BST

MPs are questioning whether Sajid Javid is really doing enough to help the steel
industry.

I will do everything in my power to help, but I cannot influence the price of
steel, says Javid

Q: But what about tariffs? Should the EU move faster to identify problems?

Speed of action is an issue, Javid replies -- that's why I called a meeting last
year to look at the issue of dumping. Europe must move faster.

Reminder: Javid actually blocked a measure to impose higher tariffs on Chinese
steel imports....

enltrJavid wants speed of action in trade defence and tariffs?! Why was he
blocking tariff increases at an EU council level then?

- Tom Blenkinsop (@TomBlenkinsop) April 28, 2016

But the business secretary is adamant that tariffs can work. Take wire rod
imports - they have gone from 67,000 tonnes to zero.

block-time published-time 11.35am BST

Javid: Pension scheme isn't a major risk to taxpayers

Q: What is your working assumption about the pension liabilities, if there is a
successful sale?

Javid says commercial sensitivities prevent him saying too much.

But several potential buyers have said they wouldn't be interested if they had
to take on Tata's pension liabilities.

It's a big scheme, with 130,000 members, and it's relatively expensive.

Q: So might the public purse be left 'holding the baby'?

No, Javid replies. Discussions are already underway to finding a solution.

Q: You really don't think it's a risk?

It's not a major risk to the public purse, no, Javid insists.

enltrMost positive comments by Javid, is his view re: BSPS and pensions issue
not being insurmountable. That is positive.

- Tom Blenkinsop (@TomBlenkinsop) April 28, 2016

block-time published-time 11.31am BST

Q: What top three lessons can we learn from the Scottish government's deal to
save two Tata steel plants?

Javid says it's hard to learn lessons - given the Scottish plans were steel
mills (recycling steel) rather than a blast furnace (which makes new metal). And
it only involved 300 jobs.

Q: But surely we can learn lessons from Scotland's speed of response? (they
brokered a deal which say Tata sell the site to Liberty House ).

Javid doesn't accept that Westminster have been acting too slowly. But we must
help workers to keep their skills 'fresh', or reskill if needed.

block-time published-time 11.26am BST

The committee aren't impressed with Javid's claims that Britain is getting
better at using home-smelted steel for big government contracts.

They point out that the Minister for Defence Procurement has admitted he doesn't
have the full records of where it sourced its steel from ( details ).

Javid reiterates that the situation is improving. But we can't always assume
that a UK steelmaker will make the most competitive bid for a project....

block-time updated-timeUpdated at 11.26am BST

block-time published-time 11.20am BST

enltrCompared to his BIS predecessors Lord Mandelson and Vince Cable, Javid
comes across as notably detached from industry and its views

- Graham Ruddick (@GrahamtRuddick) April 28, 2016

block-time published-time 11.19am BST

Q: Why hasn't the government moved faster to change procurement rules to use
more UK steel in infrastructure projects?

Javid says the government needed to ensure the changes were legally watertight.
Changes are being made, and they will make a difference.

But he accepts that they have not made an impact yet.

block-time published-time 11.18am BST

Javid has been accused of misleading the committee over SSI Redcar, by Labour MP
Tom Blenkinsop, who represents Middlesbrough South and East Cleveland.

enltrJavid saying there wasn't a single buyer for SSI last autumn, is just a
flat out lie.

- Tom Blenkinsop (@TomBlenkinsop) April 28, 2016

enltrJavid has just come out with the 80m figure again which just another LIE!

- Tom Blenkinsop (@TomBlenkinsop) April 28, 2016

block-time updated-timeUpdated at 11.22am BST

block-time published-time 11.17am BST

Redcar steel closure was an 'absolute disgrace'

The committee asks why Javid allowed the steel works at Redcar to close last
autumn.

Q: Why did you rejecting an offer from one company to keep the coke ovens open,
and ""shut the door rapidly"" on negotiations?

Javid insists that the Redcar plant didn't have a viable future, and no serious
offers. So given the uncertainty facing workers, he wanted to quickly arrange a
package to help them retrain and find new jobs.

Committee chairman Iain Wright isn't impressed, telling the secretary of state
that he should have allowed Redcar to be mothballed.

Instead, Javid allowed the ""absolute tragedy"" of a hard closure.

We've lost those skills from the steel industry for ever.....

And an absolute disgrace that it was allowed to happened on your watch.

Iain Wright Photograph: Parliament Live

block-time published-time 11.08am BST

Q: Anna Soubry says she heard about Tata's plans via Twitter. You were on the
other side of the world - how can you claim you were in control?

Javid reiterates that commercial sensitivity stopped the government from saying
more.

enltrMPs on BIS committee say Sajid Javid has given impression during steel
crisis that he is not in control of situation, he is denying this

- Graham Ruddick (@GrahamtRuddick) April 28, 2016

block-time published-time 11.06am BST

Q: The government has given some very mixed messages - first saying that
nationalisation was off the table, but now offering to do whatever it takes.

Do you accept you have been on the back foot throughout this crisis?

Javid denies this, claiming the government's message has been consistent despite
the pressure not to release commercially sensitive decisions.

He points out that minister Anna Soubry didn't rule out nationalisation, but
then adds:

Rarely is nationalisation a solution - the best companies are in private hands.

Q: You're doing it again - 'rarely' is not a decisive word. It doesn't suggest a
clear-cut plan to what's been unfolding.

Javid repeats that he is under control. It has taken time for Tata to release
info about its own plans, and the government has been reacting and adding its
own detail.

block-time published-time 11.02am BST

Javid's decision to fly to Australia last month, not Mumbai, is particularly
sensitive as he also took his teenage daughter along.

enltrJavid says ministers 'have to be ready to turn back' when they are on trade
missions (even to Australia with daughter in tow)

- James Tapsfield (@JamesTapsfield) April 28, 2016

block-time published-time 10.58am BST

enltrJavid is asked about his dislike of ""industrial strategy"". He replies that
manufacturing declined from 18% to 10% of GDP under Labour.

- Jim Pickard (@PickardJE) April 28, 2016

block-time published-time 10.58am BST

Q: Businesses complain about the lack of a level playing field, so what can be
done to help firms compete with German firms?

Javid says that more needs to be done on energy costs -- an issue which Tata UK
raised earlier in this session.

block-time published-time 10.55am BST

Some early reaction to Javid's testimony:

enltrSajid Javid seems to be getting into a tangle. Admits he knew Tata was
considering closing Port Talbot, but not clear why not in Mumbai

- Graham Ruddick (@GrahamtRuddick) April 28, 2016

enltrJavid admits that ""with benefit of hindsight"" he would have gone to Mumbai
for Tata board meeting last month

- Graham Ruddick (@GrahamtRuddick) April 28, 2016

block-time published-time 10.54am BST

Javid: With hindsight, I should have gone to Mumbai

Q: If you could turn the clock back a month, would you have attended that
meeting in Mumbai rather than going to Australia?

Of course, says Sajid Jabid. With the benefit of hindsight, knowing what Tata
would say and how it would be reported.

But the reality is that he must travel as part of his role as business
secretary.


         Key point: Javid admits he should have attended crunch board meeting
          in Mumbai.


block-time updated-timeUpdated at 12.23pm BST

block-time published-time 10.52am BST

Javid: I wasn't blindsided by Tata

Q: Isn't the truth that you were blindsided by Tata, which is why you set off to
Australia leaving no-one in London who could deal with this crisis?

No, Javid insists. Tata is a large global business, so people in every
management layer don't always have all the information about what's happening.

He denies that a better early warning system would have helped.

Q: It looked like you were on the back foot after the Mumbai meeting, in panic
mode and scrambling around to get the initiative.

Javid denied that he should have flown to Mumbai for the board meeting - that
would have been far too late. It might have made a great photo opportunity, but
it wouldn't have helped.

Instead, our work in the weeks before the meeting were crucial. And the
government couldn't have shared some information because it was legally
sensitive - announcing it could have made the situation worse.

block-time published-time 10.46am BST

Q: So when the Tata board met in Mumbai in late March, were you convinced that
they had dropped the idea of complete closure and were looking for a buyer?

Yes, says Javid.

Q: So did Tata mislead you?

No, says Javid. But he was surprised by the speed at which Tata was looking to
sell up.

Q: Frankly, secretary of state, I don't understand why you weren't in Mumbai,
says Iain Wright.

Javid repeats that he had been shocked to learn in February that Port Talbot
could close, but he had then begun looking for a buyer. So he was startled by
newspaper reports that the board decided to settle the issue 'within weeks'

That is not what we agreed with Tata, and that's not what they are not planning
to do.

Javid says he went on his (infamous) trade mission to Australia knowing that he
could return if needed - as he did.

block-time published-time 10.42am BST

Javid: We learned in February

Sajid Javid has arrived, flanked by two senior officials.

Iain Wright, BIS committee chair, goes first:

Q: You told the House on 11 April that Tata were seriously considering closing
Port Talbot.

The CEO of Tata UK has questioned that this morning [ earlier ] - so who
actually told you, and when?

Javid says that Tata India (so not the UK branch) told him in mid-February that
they were considering shutting Port Talbot and focusing on the rest of their UK
operations.

We then worked intensively to try to persuade Tata to keep funding their
operations, and embark on a turnaround plan.

But it became clear that the board might not accept that, so we began
considering whether an alternative owner could be found instead - and
considering what we could do to assist

Q: What did you do between mid-February and the Mumbai board meeting at the end
of March when the decision to sell up was taken?

Javid says he asked the company if there was anything we could do that would
prevent them from closing Port Talbot. And the short answer was no.

There were things they wanted us to do for the rest of the business - but I kept
my focus on saving Port Talbot. So we began considering whether another buyer
could be found.

Tata is a global producer, not just a UK one, so there may be another company
who could take their operations on.

block-time published-time 10.34am BST

Reminder, you can watch today's hearing here .

block-time published-time 10.32am BST

We should hear from the business secretary in a moment....

enltrSajid Javid up next at @CommonsBIS let's hope he's asked by @IainWrightMP
et al whether his decision to f",15.39286651,1,1,1
