id,text,CTTR,Score,Ellis,Moritz
187985619,"The circles in which the Tory donor and businessman David Meller moves mean that
he has occasionally been confused with David Mellor, the Major-era cabinet
minister. Yesterday, like his near-namesake, Mr Meller found himself embroiled
in scandal.

Wealthy from his family's luxury homeware and beauty business, Mr Meller, who
left school with four O levels, had thrown himself into the education world in
recent years. In 2013 he was appointed by Michael Gove as a non-executive
director of the Department for Education. In 2014 he became chairman of the
government's apprenticeship ambassador network, for which the Tory Nick Boles
praised him at the dispatch box - before having to clarify, after jeers, ""not
that David Mellor"".

In 2016 Mr Meller became chairman of the government's apprenticeship delivery
board and earlier this month Nadhim Zahawi, the minister who attended the
controversial dinner, became his co-chairman. Last year he joined the board of
the Mayor's Fund for London, a social mobility scheme, and in this month's New
Year's honours list he was made a CBE for services to education. His involvement
in the Presidents Club, revealed yesterday, means that of the stream of
accolades, only the CBE remains.

Mr Meller, 59, is joint chairman of the organisation's charitable trust,
alongside Bruce Ritchie, a property developer. His political ties began with an
interest in education. He is chairman of the Meller Educational Trust, which
governs two secondary schools on the outskirts of London and is involved with
more schools.

Between 2009, when he formed the trust, and last June, he gave more than 60,000
to the Tory party including to the local parties of a specific Tory MPs,
including Robert Halfon and Liz Truss. In 2016 he gave 3,250 to Mr Gove's
leadership campaign.",6.982620784,0,0,0
187878477,"ABSTRACT

After a career in journalism and the City, the ambitious MP narrowly lost out to
Nick Clegg for the Lib Dem leadership

FULL TEXT

The Liberal Democrat MP for Eastleigh, Hampshire, was born Christopher Murray
Paul-Huhne, the son of a businessman and an actor who was once, reputedly, the
voice of the speaking clock.

He enjoyed a privileged education at the prestigious fee-paying Westminster
School before studying at the Sorbonne in Paris. At Magdalen College, Oxford, he
ditched the double-barrel to become plain Chris Huhne, edited the student
magazine Isis, served on the executive of the Oxford University Labour Club and
gained a first-class degree in PPE.

He set out on a career in journalism, working for the Liverpool Daily Post and
Echo, and working as an economics editor and columnist on the Guardian and
Independent newspaper titles.

Before embarking on a political career Huhne worked in the City, becoming
managing director of Fitch IBCA and then vice-chairman of Fitch Ratings. After
unsuccessfully contesting Reading East and the Oxford West and Abingdon seats
for the Liberal Democrats in two general elections, he was elected as a member
of the European parliament for south-east England in 1999.

He won the Eastleigh seat in May 2005 with a majority of just 568.

Overtly ambitious, within months of becoming an MP he was challenging for the
leadership of his party following the resignation of Charles Kennedy but lost
out to Sir Menzies Campbell. Two years later, he challenged Nick Clegg for the
top job, losing by a slender margin.

Huhne retained his Eastleigh seat in May 2010 with an increased majority over
the Conservatives of 3,864.",6.670137985,0,0,0
154865449,"ABSTRACT

Housing associations' help for 'generation rent'

FULL TEXT

Sign up to Society daily email briefing

Today's top SocietyGuardian stories

 London housing associations join private market to fund affordable rents US
doctors cure child born with HIV 'Bedroom tax' will hit single parents and
disabled people hardest Hospital registrars' workload 'unmanageable', says
report 43,000 strip-searches carried out on children as young as 12 Lib Dems
'all ears' to Labour's mansion tax debate NHS watchdog to tackle malnutrition
in hospitals Why do the police deal with rape cases so badly?All today's
SocietyGuardian stories

The pick of the weekend's SocietyGuardian news and comment

 Doctors cry foul at NHS 'privatisation by stealth' Barbara Ellen: How shaming
the poor became our new bloodsport NHS: bereaved mother vows to fight
commercialisationAll Sunday's SocietyGuardian news and featuresAll Saturday's
SocietyGuardian news and features

Jobs of the week

 Director, Haringey Citizens Advice Bureau: ""A dynamic and innovative director
is sought to establish and lead Healthwatch Haringey from April 2013 to provide
strategic vision, leadership, management and operational direction for a small
team of dedicated staff and volunteers. Responsible for delivering services to
improve the health and social care user experience and enabling health and
social care users and the wider public to have a stronger voice in the shaping
of health and social care services in Haringey. The successful candidate must
have a proven successful track record in both community engagement and consumer
representation, probably within the field of health and social care."" Press
officer, House of Lords Senior communications officer, House of LordsThe
Guardian's public and voluntary sector careers pageHundreds of public and
voluntary sector jobs

On the Guardian Professional Networks

 Happier, more engaged NHS stafflead to better patient care, says Jenny King
As a new statistical analysis of the housing sector is published, John Perry
asks who benefits from public funding It is thought that more young people are
self-harming, but awareness training for social care professionals is patchy.
Ben Cook reports

On my radar ...

 Novellist AL Kennedy, who has written for Comment is free on Downton values
and the ""austerity state"". She writes:

Those wealthy enough to own land are endlessly rewarded, everyone else can fight
it out. And the English just put up with it. New Downton means the most
vulnerable do most to support the debt bubble on which our economy balances.
Those least able to manage have to manage most: the culled council house stock,
the impossibility of escaping high rents, the bedroom tax, the lack of
one-bedroom houses, in short the endless hounding of people who have done
nothing wrong other than to be poor, old, young, weak, female, not white. If you
like, having no one left to prey upon, the empire has come home to eat itself
and, although I hate to contradict David Cameron, being consumed by an alien
power only makes for a wonderful party if you like being a canap.It seems the
next tranche of ""welfare reforms"" - I suppose hitting something with a hammer
does reform it - will compel all claimants to open bank accounts. It's more than
possible that negative interest rates will then punish them for doing so. Beyond
April, the Downton state will cleanse whole boroughs of the financially onerous
and potentially unsightly poor. (Sort of like asking your servants to use the
back stairs, so you don't have to see them. Or tunnels. Tunnels would be good.)
And anyone who needs a disability benefit to survive will be forced deeper into
repeating cycles of cynical reassessments, humiliation, cancellations, appeals,
stress, reinstated benefits, reassessments... Outside the Paralympics, most
disabilities below penthouse level are not lauded.

 Campaigner Sue Marsh, who has blogged on her experience as a hospital patient
over recent weeks. Compared with 2007, she writes, hospitals ""are horribly,
dangerously and miserably short staffed"". In a post directed at David Cameron
and the health secretary, Jeremy Hunt, she writes:

Oh, you can go on about ""cutting management waste"" or ""streamlining"" but as you
knew very well, we already had one of the most efficient health services in the
world. You can hide behind your statistics, you can obfuscate about ""no real
term cuts"" but you know as well as I do, the NHS needs 6% extra per year to
survive. And it's not getting it. AND you're insisting they restructure from top
to bottom at the same time.So this is my experience, as a patient : Some of the
deaths will be down to cruelty. Bad practice leads to bullying and cruelty. A
ward or indeed a hospital, out of control, that has lost sight of the patients
it is there to serve will kill people. Just as they did in Mid Staffs. But let's
not kid ourselves any longer - it's happening up and down the country. Until we
face this and accept we are only ""angels"" under the right circumstances, people
will die. Lots of them. Our Mums and Dads and Sons and Daughters and Babies and
Wives and Husbands will die. Say it again. They'll die. Needlessly and in
lonely, desperate misery.But more will die from cuts. And the trauma will be
double. Because the staff who are left WILL care and will simply be unable to do
the jobs of four or five. They will go home, every night, knowing they left a
patient in pain. Knowing they left them hungry. Knowing they left them lying in
their own filth or dehydrated or without vital feeds or medicines. Perhaps their
blood slowly seeping away onto the floor, left for a night shift who fight all
night, 2 staff short to save a life and never get a chance to staunch the flow.
Dying quietly or dying dramatically, we'll all be dying.

 The defence secretary, Philip Hammond, who told the Telegraph this weekend
that defence spending should be the chancellor's priority, and cuts should
instead come from the welfare budget. He said:

There is a body of opinion within Cabinet that we have to look at the welfare
budget again. The welfare budget is the bit of public spending that has risen
the furthest and the fastest and if we are going to get control of public
spending on a sustainable basis, we are going to have to do more to tackle the
growth in the welfare budget.

And he added:

I am a Conservative. The kind of Conservatism I was brought up on says that the
first priority of the government is defending the country and maintaining law
and order. Those are the two top priorities for me.

In response, Sarah Ismail, editor of the Same Difference blog, writes:

Sir, please defend the country. Please maintain law and order. But please
remember that many of the very people who live every day in the very country you
work so hard to defend are using the welfare budget to survive. If you cut the
welfare budget any further, Sir, your soldiers will return to a country which
will have a much smaller population than the country they left behind. Then your
soldiers will have less people to defend, Sir, and then you won't be able to
complain about cuts to your defense department.

 Professor David Croisdale-Appleby, who has been appointed as chair of charity
Dementia UK. Croisdale-Appleby, who is independent chair of Skills for Care, is
a professional corporate strategist and is a strategic adviser to a number of UK
and international organisations.

Other news

 BBC: Benefit plans target new EU migrants Children & Young People Now: Gove
confirms DfE could relinquish responsibility for youth policy
CivilSociety.co.uk: Tesco chooses Diabetes UK as 10m partner Community Care:
Patients face 'unacceptable waits' of up to 48 hours for Mental Health Act
assessments Independent: Government to try 'crowd sourcing' key policies to see
'What Works' Inside Housing: Children launch legal challenge to 'bedroom tax'
LocalGov.co.uk: Pickles - Councils should cut union facility time to save funds
Public Finance: 'Bedroom tax' support fund 100m short, says NHF Telegraph:
Wake up and cut taxes, Tories tell Chancellor Third Sector: Acevo document
outlines frustrations of members with local authorities on contracts

SocietyGuardian blogs

Patrick Butler's cuts blogSarah Boseley's global health blog

SocietyGuardian on social media

Follow SocietyGuardian on TwitterFollow Patrick Butler on TwitterFollow Clare
Horton on TwitterFollow Alison Benjamin on TwitterSocietyGuardian's Facebook
page

SocietyGuardian links

SocietyGuardian.co.ukThe Guardian's public and voluntary sector careers
pageHundreds of public and voluntary sector jobs

SocietyGuardian editor: Alison BenjaminEmail the SocietyGuardian editor:
society@guardian.co.uk",13.0307793,1,1,1
