id,text,CTTR,Score,Ellis,Moritz
187965065,"The sales of multimillion-pound properties hit a record high last year, even as
those down the ladder struggled to gain a foothold.

According to Lloyds TSB, 1,518 sales were worth at least 2 million, up from
1,442 in 2010. This is the highest number of sales in this bracket since records
began 17 years ago.

Sales of properties topping the 2 million mark were also 2 per cent higher last
year than at the peak of the housing market in 2007. More than three quarters of
all 2 million-plus sales in 2011 were in London, and more than half of all
multimillionpound sales took place in three boroughs: Kensington and Chelsea,
Westminster and Camden.

In addition, the number of properties selling for more than 5 million rose by
22 per cent, from 128 in 2010 to 156, providing further evidence of the strength
of sales at the top end of the market.

But despite the increase in sales, Lloyds estimates that only 0.2 per cent of
all homes in Britain are worth at least 2 million and, therefore, potentially
subject to the new7 per cent stamp duty rate. Even in London, multimillion-pound
sales account for only 1.3 per cent of all properties.

Suren Thiru, a Lloyds housing economist, said: ""The rise in the number of
multimillion-pound property sales over the past year compares to the weakening
picture across the rest of the market, highlighting the strength at the very top
end of the housing market.""

She believes that continuing demand from cash-rich buyers, from Britain and
overseas, as well as limited supply, has meant that this segment of the market
remains largely immune to the headwinds facing the vast majority of homebuyers.

However, the total number of sales of properties that cost at least 1 million
in Britain was 5 per cent lower last year than in 2010. This compares with a 55
per cent increase in 2010.",5.749411944,0,0,0
187971781,"The Princess Royal, 64; Ben Affleck, actor, Argo (2012), 42; Richard Deacon,
abstract sculptor, 65; Professor Andrew Gamble, political scientist and author,
The Sceptre at the Feast (2009), 67; John Gilhooly, artistic and executive
director, Wigmore Hall, 41; Laura Mulvey, director, Birkbeck Institute for the
Moving Image, 73; Janice Murray, director, National Army Museum, 57; James
O'Donnell, organist and master of the choristers, Westminster Abbey, 53; Sir
Oliver Popplewell, High Court judge, Queen's Bench Division (1983-99), 87; Tony
Robinson, actor, Blackadder (1983-89), 68; Judge John Samuels, QC, president,
Prisoners' Education Trust, 74; Jack Sheffield, author, Teacher, Teacher!, 69;
the Ven Nicola Sullivan, archdeacon of Wells, 56; Lord (William) Waldegrave of
North Hill, provost of Eton College, 68; Air Chief Marshal Sir William Wratten,
AOC-in-C, Strike Command (1994-97), 75.",6.174635708,0,0,0
187970594,"A coalition partner in the Danish Government of Helle Thorning-Schmidt quit
yesterday over the sale of a large stake in a state-controlled energy group to
Goldman Sachs.

The privatisation of Dong Energy required votes from the centre-Right opposition
to pass through parliament. Ms Thorning-Schmidt brushed off calls for a snap
election after the Socialist People's Party walked away from her coalition,
adding fresh pressure after a damaging spy scandal almost brought her Government
down this month.

A poll conducted by the broadcaster TV2 showed that 68 per cent of Danes were
against Goldman holding the stake, and hundreds of protesters gathered outside
the parliament last night to voice their anger over the deal.

The Danish Parliament's Finance Committee yesterday approved the sale of a 19
per cent stake in Dong Energy, the country's largest energy group, for DKr8
billion (882 million), after the utility lost money on natural gas investments.
In a financial restructuring announced a year ago, the company pledged last year
to reduce its debt and increase investments in oil and gas exploration, as well
as in wind farms. Poul Nyrup Rasmussen, a former Social Democrat Prime Minister,
called Goldman a ""shady partner"".

""Parliament has now ensured that one of our largest companies ... can make
massive investments, instead of scaling back,"" Bjarne Corydon, the Finance
Minister, said.

Ian King, page 43",6.817257513,0,0,1
